{
  "$schema": "http://json-schema.org/draft-07/schema#",
  "title": "ServiceSpec",
  "type": "object",
  "required": ["name", "namespace", "image", "service"],
  "properties": {
    "name": {
      "type": "string",
      "pattern": "^[a-z0-9]([-a-z0-9]*[a-z0-9])?$",
      "description": "Kubernetes service name (DNS-1123 compliant)"
    },
    "namespace": { "type": "string" },
    "replicaCount": { "type": "integer", "minimum": 1 },

    "labels": {
      "type": "object",
      "additionalProperties": { "type": "string" }
    },

    "image": {
      "type": "object",
      "required": ["repository", "tag"],
      "properties": {
        "repository": { "type": "string" },
        "tag": { "type": "string" },
        "pullPolicy": {
          "type": "string",
          "enum": ["Always", "IfNotPresent", "Never"]
        },
        "environment": { "type": "string" }
      }
    },

    "service": {
      "type": "object",
      "required": ["port"],
      "properties": {
        "type": {
          "type": "string",
          "enum": ["ClusterIP", "NodePort", "LoadBalancer"]
        },
        "port": { "type": "integer", "minimum": 1, "maximum": 65535 },
        "targetPort": { "type": "integer", "minimum": 1, "maximum": 65535 }
      }
    },

    "resources": {
      "type": "object",
      "properties": {
        "limits": {
          "type": "object",
          "properties": {
            "cpu": { "type": "string" },
            "memory": { "type": "string" }
          }
        },
        "requests": {
          "type": "object",
          "properties": {
            "cpu": { "type": "string" },
            "memory": { "type": "string" }
          }
        }
      }
    },

    "env": {
      "type": "array",
      "items": {
        "type": "object",
        "required": ["name"],
        "properties": {
          "name": { "type": "string" },
          "value": { "type": "string" }
        }
      }
    },

    "envFrom": {
      "type": "array",
      "items": {
        "type": "object",
        "properties": {
          "configMapRef": { "type": "string" },
          "secretRef": { "type": "string" }
        },
        "minProperties": 1,
        "maxProperties": 1
      }
    },

    "secrets": {
      "type": "array",
      "items": {
        "type": "object",
        "required": ["name", "type", "data"],
        "properties": {
          "name": { "type": "string" },
          "type": { "type": "string" },
          "data": {
            "type": "object",
            "additionalProperties": { "type": "string" }
          }
        }
      }
    },

    "configmaps": {
      "type": "array",
      "items": {
        "type": "object",
        "required": ["name", "data"],
        "properties": {
          "name": { "type": "string" },
          "data": {
            "type": "object",
            "additionalProperties": { "type": "string" }
          }
        }
      }
    },

    "volumes": {
      "type": "array",
      "items": {
        "type": "object",
        "required": ["name"],
        "properties": {
          "name": { "type": "string" },
          "secret": {
            "type": "object",
            "required": ["secretName"],
            "properties": {
              "secretName": { "type": "string" }
            }
          },
          "configMap": {
            "type": "object",
            "required": ["name"],
            "properties": {
              "name": { "type": "string" }
            }
          }
        }
      }
    },

    "volumeMounts": {
      "type": "array",
      "items": {
        "type": "object",
        "required": ["name", "mountPath"],
        "properties": {
          "name": { "type": "string" },
          "mountPath": { "type": "string" }
        }
      }
    },

    "ingress": {
      "type": "object",
      "properties": {
        "enabled": { "type": "boolean" },
        "className": { "type": "string" },
        "host": { "type": "string" },
        "path": { "type": "string" },
        "pathType": {
          "type": "string",
          "enum": ["Prefix", "Exact", "ImplementationSpecific"]
        },
        "tls": {
          "type": "object",
          "properties": {
            "enabled": { "type": "boolean" },
            "secretName": { "type": "string" }
          }
        }
      }
    },

    "nodeSelector": {
      "type": "object",
      "additionalProperties": { "type": "string" }
    },

    "affinity": {
      "type": "object"
    },

    "tolerations": {
      "type": "array",
      "items": { "type": "object" }
    }
  }
}
